#,Type,Scenario Name,Problem Summary,Prerequisites,Tool Features,Success Criteria,Min Pass,Deliverables,Chain/Category
1,🆕 NEW,GlobalTech HR System - Employee Database,"GlobalTech Industries, 200+ employee tech company, transitioning from paper HR records to digital. HR Director Sarah Chen needs database tracking: personal details, departments, salaries, hire dates, manager relationships. CFO requires USD salary format, Legal mandates hire date tracking for compliance.",None,"CREATE TABLE, PRIMARY KEY, FOREIGN KEY (self-referencing), AUTO_INCREMENT, INSERT, SELECT, NOT NULL, UNIQUE, DEFAULT, data types (INTEGER, VARCHAR, DECIMAL, DATE, BOOLEAN)","13 criteria, 100 pts",80 pts,"SQL script (CREATE TABLE, INSERT 20+ employees, verification queries), table structure screenshot, SELECT * screenshot, documentation (200 words)",Employee Chain START → #1→#4→#10→#21→#24→#51→#111
2,🆕 NEW,RetailMart Inventory System,"RetailMart regional retail chain, 15 stores, 500+ SKUs. Operations Manager David Martinez overwhelmed with Excel tracking. CEO approved digital transformation. Need database tracking: SKU, category (Electronics/Clothing/Home Goods), prices, stock quantities, reorder levels, suppliers. Finance requires non-negative prices, Warehouse Manager insists no negative inventory.",None,"CREATE TABLE, CHECK constraints, IN operator in CHECK, DEFAULT with functions (CURRENT_DATE, CURRENT_TIMESTAMP), ON UPDATE CURRENT_TIMESTAMP, TEXT vs VARCHAR, constraint naming","13 criteria, 100 pts",80 pts,"SQL script (CREATE TABLE, INSERT 30+ products), constraint error screenshots, low-stock query screenshot, documentation (250 words)",Product Chain START → #2→#6→#9→#14→#25→#114
3,🆕 NEW,E-Shop Order Management Schema,"E-Shop online platform processes 100+ orders daily. Customer Service Manager Lisa Thompson reports 10-15 minute delays cross-referencing spreadsheets. IT Director needs relational database: customers table, orders table (with customer FK), order_items table (with order FK, CASCADE delete). CFO requires automatic cascade deletion of line items when orders deleted.",None,"Multi-table schema design, FOREIGN KEY relationships (one-to-many), ON DELETE CASCADE, ON UPDATE CASCADE, CHECK constraints on multiple tables, relationship integrity, INNER JOIN, LEFT JOIN basics","13 criteria, 100 pts",80 pts,"SQL scripts (3 CREATE TABLEs, INSERT 25 customers/40 orders/80+ items), relationship diagram screenshot, CASCADE deletion demo, multi-table JOIN screenshot, documentation (300 words)",Order Chain START → #3→#5→#11→#22→#23→#112→#113→#119
4,🔗 CONTINUES,GlobalTech High-Earner Analysis,"HR Director Sarah needs employees earning >$80k for leadership training program. CFO approved program for high-value positions only. Generate reports: (1) all high earners sorted highest-to-lowest, (2) calculate total program cost, (3) Engineering dept high earners separately for retention bonus consideration.",Assignment #1 (employees table must exist),"WHERE clause, comparison operators (>, >=, <, <=, =, !=), ORDER BY DESC/ASC, AND operator for compound conditions, column aliases with AS, calculated fields (arithmetic in SELECT)","9 criteria, 100 pts",75 pts,"SQL script (8 queries from tasks), sorted high-earner screenshot, Engineering-only screenshot, documentation (150 words on > vs >=, ORDER BY importance)",Employee Chain: #1→#4→#10→#21→#24→#51→#111
5,🔗 CONTINUES,E-Shop Monthly Sales Report,"CFO needs monthly sales trends for board meeting tomorrow. Finance department requires: last 30 days order summary showing order counts, total revenue, average order values. Must be date-filtered correctly for accurate board presentation.",Assignment #3 (orders table must exist),"Date filtering, DATE functions (CURRENT_DATE, DATE_SUB/DATEADD, DATEDIFF), WHERE with date comparisons, BETWEEN for date ranges, date arithmetic","10 criteria, 100 pts",75 pts,"SQL script (30-day queries), monthly report screenshot, documentation (150 words on date filtering techniques)",Order Chain: #3→#5→#11→#22→#23→#112→#113→#119
6,🔗 CONTINUES,RetailMart Multi-Category Product Search,"Store managers preparing for weekend sale need quick product lookup across Electronics, Computers, and Accessories categories simultaneously. Current system requires running 3 separate queries or writing tedious OR statements. Need efficient single-query solution.",Assignment #2 (products table must exist),"IN operator, WHERE with value lists, NOT IN for exclusion, combining IN with other WHERE conditions, multiple value matching","8 criteria, 100 pts",75 pts,"SQL script (IN queries), multi-category results screenshot, documentation (100 words on IN vs multiple ORs)",Product Chain: #2→#6→#9→#14→#25→#114
7,🆕 NEW,TechSales CRM - Customer Name Search,"TechSales Inc sales team launching targeted ""Smith Family"" campaign. Need to find ALL customers with ""Smith"" anywhere in first or last name. Current exact-match system misses variations like Smithson, Smithfield, Blacksmith. Pattern matching required.",None - create customers table with 30+ varied names,"LIKE operator, wildcards (% for any characters, _ for single character), case-insensitive search with UPPER/LOWER, pattern matching, combining LIKE with OR","10 criteria, 100 pts",75 pts,"SQL script (CREATE TABLE, INSERT 30 customers with name variations, LIKE queries), pattern matching screenshots, documentation (150 words)",STANDALONE - Pattern matching demonstration
8,🆕 NEW,DigitalCorp Data Quality Audit,DigitalCorp Marketing discovered 15% of customer database lacks email OR phone contact info. Compliance team preparing for GDPR audit next month needs complete report of ALL incomplete records for immediate cleanup campaign. Missing contacts = compliance violation.,None - create customers table with intentional NULL values,"IS NULL, IS NOT NULL, OR operator, NULL handling in WHERE, COALESCE for NULL replacement, IFNULL/ISNULL (MySQL/SQL Server), counting NULLs","12 criteria, 100 pts",75 pts,"SQL script (CREATE TABLE with NULLs, NULL-finding queries, COALESCE examples), incomplete records report screenshot, documentation (200 words on NULL handling)",STANDALONE - NULL value handling techniques
9,🔗 CONTINUES,RetailMart Mid-Range Price Analysis,"RetailMart targeting mid-market customers with ""value products"" promotion. Need all products priced $50-$200 (inclusive boundaries). Marketing wants count by category and products sorted by price for promotional materials.",Assignment #2 (products table must exist),"BETWEEN operator (inclusive ranges), range queries, combining BETWEEN with other WHERE conditions, understanding boundary inclusion","8 criteria, 100 pts",75 pts,"SQL script (BETWEEN queries), price range results screenshot, documentation (100 words on BETWEEN vs >= AND <=)",Product Chain: #2→#6→#9→#14→#25→#114
10,🔗 CONTINUES,GlobalTech Hierarchical Department Sorting,"HR creating printed org chart for company all-hands meeting. Need employee list sorted: (1) department alphabetically, (2) within each department, salary descending (highest to lowest). CFO wants to see highest earners first within each dept.",Assignment #1 (employees table must exist),"ORDER BY with multiple columns, primary and secondary sort, ASC and DESC combinations, hierarchical sorting","7 criteria, 100 pts",75 pts,"SQL script (multi-column ORDER BY), hierarchical sort screenshot, documentation (100 words on sort order)",Employee Chain: #1→#4→#10→#21→#24→#51→#111
11,🔗 CONTINUES,E-Shop Sales Dashboard Metrics,"Executive dashboard homepage displays key metrics CEO checks every morning: (1) Total number of orders, (2) Total revenue (sum of all order totals), (3) Average order value. Need all three metrics calculated in single query with clear labels.",Assignment #3 (orders table must exist),"COUNT(*) for row counting, SUM() for totals, AVG() for averages, column aliases for clarity, multiple aggregates in one query","9 criteria, 100 pts",75 pts,"SQL script (aggregate query), dashboard metrics screenshot, documentation (100 words on aggregate functions)",Order Chain: #3→#5→#11→#22→#23→#112→#113→#119
12,🔗 CONTINUES,RetailMart Revenue by Category,"Finance Director needs quarterly earnings report showing total revenue broken down by product category (Electronics, Clothing, Home Goods). Board wants to see which categories performing best. Sort by revenue highest to lowest.",Assignment #2 (products table must exist) - add revenue/sales data,"GROUP BY basics, SUM() with grouping, aggregating by category, sorting grouped results with ORDER BY","8 criteria, 100 pts",75 pts,"SQL script (GROUP BY query), category revenue screenshot, documentation (100 words on GROUP BY)",Product Chain: #2→#6→#9→#14→#25→#114
13,🔗 CONTINUES,GlobalTech High-Performing Departments,"CFO allocating additional budget for team expansion. Only departments with average salary >$70,000 qualify (high-performing teams). Need list of qualifying departments with their average salaries sorted by average.",Assignment #1 (employees table must exist),"HAVING clause for filtering grouped results, AVG() with GROUP BY, HAVING vs WHERE difference, filtering aggregates","9 criteria, 100 pts",75 pts,"SQL script (GROUP BY with HAVING), qualifying departments screenshot, documentation (150 words on HAVING vs WHERE)",Employee Chain: #1→#4→#10→#21→#24→#51→#111
14,🔗 CONTINUES,RetailMart Price Range by Category,"Product team preparing pricing strategy meeting. Need to know cheapest and most expensive product in EACH category (not overall). Show category name, min price with product name, max price with product name.",Assignment #2 (products table must exist),"MIN() and MAX() functions, GROUP BY with multiple aggregates, subqueries to get product names at min/max prices","10 criteria, 100 pts",75 pts,"SQL script (MIN/MAX with product names), price extremes screenshot, documentation (150 words)",Product Chain: #2→#6→#9→#14→#25→#114
15,🔗 CONTINUES,E-Shop Unique Customer Count,"Marketing calculating Customer Acquisition Cost (CAC). Need accurate count of unique customers who placed orders, NOT total order count. Customer who ordered 5 times counts as 1, not 5. Critical for CAC calculation.",Assignment #3 (orders table must exist),"COUNT(DISTINCT column) for unique counting, difference between COUNT(*) and COUNT(DISTINCT), handling duplicates in aggregation","7 criteria, 100 pts",75 pts,"SQL script (COUNT vs COUNT DISTINCT comparison), unique customer count screenshot, documentation (100 words)",Order Chain: #3→#5→#11→#22→#23→#112→#113→#119
16,🔗 CONTINUES,RetailMart Comprehensive Category Report,"Quarterly board meeting tomorrow. CEO needs complete category analysis in single report: product count, total sales revenue, average price, minimum price, maximum price - all per category. One comprehensive query.",Assignment #2 (products table with sales data),"Multiple aggregations in one query (COUNT, SUM, AVG, MIN, MAX together), comprehensive reporting, formatting aggregate results","10 criteria, 100 pts",75 pts,"SQL script (multiple aggregates), comprehensive report screenshot, documentation (100 words)",Product Chain: #2→#6→#9→#14→#25→#114
17,🔗 CONTINUES,E-Shop Monthly Revenue Trend,"CFO presenting to board needs month-by-month revenue trend for past 12 months. Show each month with total revenue, sorted chronologically (January first, December last). Trend analysis for growth discussion.",Assignment #3 (orders table with dates spanning 12+ months),"Date aggregations, GROUP BY with MONTH() and YEAR() functions, DATE_FORMAT for display, chronological sorting of months","9 criteria, 100 pts",75 pts,"SQL script (monthly aggregation), 12-month trend screenshot, documentation (100 words on date grouping)",Order Chain: #3→#5→#11→#22→#23→#112→#113→#119
18,🔗 CONTINUES,E-Shop Order Status Breakdown,"Operations Manager needs order status distribution PER customer for service quality review. Show each customer with separate counts: Pending orders, Processing orders, Shipped orders, Delivered orders, Cancelled orders - all in ONE row per customer.",Assignment #3 (orders table with status field),"Conditional aggregation with CASE WHEN, SUM(CASE WHEN status=X THEN 1 ELSE 0 END) pattern, pivot-like results, multiple status counts per row","11 criteria, 100 pts",80 pts,"SQL script (conditional aggregation), status breakdown screenshot showing all statuses as columns, documentation (150 words)",Order Chain: #3→#5→#11→#22→#23→#112→#113→#119
19,🆕 NEW,Customer Service - Order Items List,"Customer service taking phone calls needs to quickly see all products in each order as comma-separated list. ""Order #1001 contains: Laptop, Mouse, Keyboard, Monitor"" instead of 4 separate rows. Faster phone support.",Create simple orders and order_items tables,"GROUP_CONCAT (MySQL) or STRING_AGG (PostgreSQL), string aggregation functions, GROUP BY with string concatenation, delimiter specification","8 criteria, 100 pts",75 pts,"SQL script (table creation, string aggregation queries), comma-separated lists screenshot, documentation (100 words)",STANDALONE - String aggregation technique
20,🆕 NEW,Sales Performance - Nested Aggregation,"VP Sales questioning if average monthly revenue truly representative. Calculate: (1) Average of monthly averages, (2) Overall average across all days. Compare results. Understand difference for seasonality analysis.",None - create sales table with daily data across multiple months,"Nested aggregation, subquery with aggregate, AVG(AVG(...)) concept, derived tables, understanding weighted vs unweighted averages","10 criteria, 100 pts",80 pts,"SQL script (nested aggregation comparison), results showing both averages, documentation (200 words explaining why different)",STANDALONE - Advanced aggregation concepts
21,🔗 CONTINUES,GlobalTech Employee-Department Details,"HR report needs employee names with full department information (department name, location, department manager). Currently employees table only has dept_id. Need to JOIN with departments table to get details.",Assignment #1 (employees) + create departments table,"INNER JOIN, ON clause, joining two tables, selecting columns from both tables, table aliases, basic relationship traversal","9 criteria, 100 pts",75 pts,"SQL script (departments table creation, INNER JOIN query), joined results screenshot, documentation (150 words on INNER JOIN)",Employee Chain: #1→#4→#10→#21→#24→#51→#111
22,🔗 CONTINUES,E-Shop All Customers Including Non-Buyers,"Marketing launching ""We Miss You"" campaign to customers who NEVER ordered. Need ALL customers shown, with order info for those who ordered, NULL for those who didn't. LEFT JOIN preserves all customers even without orders.",Assignment #3 (customers and orders tables),"LEFT JOIN (LEFT OUTER JOIN), preserving all left table rows, NULL values for unmatched right rows, identifying non-matching records with IS NULL","10 criteria, 100 pts",75 pts,"SQL script (LEFT JOIN), results showing customers with NULL orders, documentation (150 words on LEFT JOIN)",Order Chain: #3→#5→#11→#22→#23→#112→#113→#119
23,🔗 CONTINUES,E-Shop Complete Order Details,"Customer Service phone support needs single query showing: customer name, order date, ALL products ordered (with quantities and prices). Currently scattered across 3 tables. JOIN customers→orders→order_items for complete picture.","Assignment #3 (customers, orders, order_items tables)","Multiple table JOIN (3+ tables), chaining JOINs, FROM table1 JOIN table2 JOIN table3 syntax, complete data assembly","11 criteria, 100 pts",80 pts,"SQL script (3-table JOIN), complete order details screenshot, documentation (150 words on multi-table JOINs)",Order Chain: #3→#5→#11→#22→#23→#112→#113→#119
24,🔗 CONTINUES,GlobalTech Employee-Manager Relationship,Org chart needs each employee listed with their direct manager's name. employees table has manager_id referencing another employee_id (self-referencing). Use self-JOIN to get manager names.,Assignment #1 (employees with manager_id column),"Self-JOIN, joining table to itself, table aliases (e1, e2), self-referencing foreign keys, handling NULL managers (top-level employees)","10 criteria, 100 pts",80 pts,"SQL script (self-JOIN), employee-manager pairs screenshot, documentation (200 words on self-joins)",Employee Chain: #1→#4→#10→#21→#24→#51→#111
25,🔗 CONTINUES,RetailMart Products Never Ordered,Inventory Manager reviewing product line. Need list of products with ZERO sales ever (never appear in order_items). These are discontinuation candidates. Use LEFT JOIN + IS NULL to find products without order records.,Assignment #2 (products) + Assignment #3 (order_items) or create order_items,"LEFT JOIN to find unmatched records, IS NULL filtering, anti-join pattern, identifying orphaned records","9 criteria, 100 pts",75 pts,"SQL script (LEFT JOIN anti-join), never-ordered products screenshot, documentation (150 words on anti-join)",Product Chain: #2→#6→#9→#14→#25→#114
26,🔗 CONTINUES,E-Shop Customer Lifetime Value (LTV),Marketing needs each customer with their total lifetime spending (sum of all order totals). Identify VIP customers (top spenders) for exclusive rewards program. JOIN customers with aggregated order totals.,Assignment #3 (customers and orders tables),"JOIN with aggregation, GROUP BY on joined tables, SUM() after JOIN, calculating customer metrics","9 criteria, 100 pts",75 pts,"SQL script (JOIN with SUM), customer LTV ranking screenshot, documentation (150 words on JOIN + aggregation)",Order Chain: #3→#5→#11→#22→#23→#112→#113→#119
27,🆕 NEW,University Student-Course Enrollment,University registrar needs students matched to courses where BOTH enrollment_date matches AND semester matches (Fall 2024). Single condition JOIN insufficient - need AND in ON clause for complex matching.,"None - create students, courses, enrollments tables","JOIN with multiple conditions, AND in ON clause, complex matching logic, multi-criteria relationships","10 criteria, 100 pts",75 pts,"SQL script (3 tables, multi-condition JOIN), enrollment results screenshot, documentation (150 words)",STANDALONE - Multi-condition JOIN technique
28,🆕 NEW,Warehouse Product Distribution Planning,Logistics team planning optimal distribution. Need EVERY possible product-warehouse combination (Cartesian product) to evaluate which products should stock in which warehouses. All combinations required for analysis.,"None - create products table (10 products), warehouses table (5 warehouses)","CROSS JOIN, Cartesian product, use cases for CROSS JOIN, result size calculation (rows = table1_rows × table2_rows)","8 criteria, 100 pts",75 pts,"SQL script (CROSS JOIN), all combinations screenshot (50 rows expected), documentation (150 words)",STANDALONE - CROSS JOIN demonstration
29,🆕 NEW,Product Price Tier Assignment,"Sales team needs products categorized into pricing tiers: Budget ($0-50), Mid-Range ($50-150), Premium ($150+). Create price_tiers table, use non-equi JOIN with BETWEEN to assign each product its tier.",None - create products and price_tiers tables,"Non-equi JOIN, BETWEEN in JOIN condition (ON price BETWEEN tier_min AND tier_max), range-based matching","9 criteria, 100 pts",75 pts,"SQL script (tier assignment JOIN), products with tiers screenshot, documentation (150 words)",STANDALONE - Non-equi JOIN technique
30,🔗 CONTINUES,Query Performance: JOIN vs Subquery,"Employee-department query running slow. Compare two approaches: (1) JOIN employees to departments, (2) Subquery to get dept name. Use EXPLAIN to see which faster. Understand query optimization.",Assignment #1 (employees) with departments table,"EXPLAIN or EXPLAIN ANALYZE, reading execution plans, query optimization comparison, JOIN vs subquery performance","11 criteria, 100 pts",80 pts,"SQL script (both approaches, EXPLAIN for each), execution plan screenshots, performance comparison, documentation (200 words)",Employee Chain: #1→#4→#10→#21→#24→#51→#111
31,🔗 CONTINUES,RetailMart Product Code Parsing,"Product SKUs formatted as ""CAT-TYPE-NUMBER"" (e.g., ""ELE-LAPT-001"" = Electronics-Laptop-001). Analytics team needs each component in separate columns: category_code, product_type, sequence_number. Parse using string functions.",Assignment #2 (products with SKU column),"SUBSTRING/SUBSTR, LEFT, RIGHT, MID, string extraction, POSITION/LOCATE, CHARINDEX, parsing delimited strings","10 criteria, 100 pts",75 pts,"SQL script (parsing queries with multiple approaches), parsed components screenshot, documentation (150 words)",Product Chain: #2→#6→#9→#14→#25→#114
32,🔗 CONTINUES,GlobalTech Full Name Formatting,"HR reports need ""Last, First"" format (e.g., ""Chen, Sarah"") instead of separate first_name and last_name columns. Some employees have middle names (nullable) - handle gracefully with COALESCE or CONCAT_WS.",Assignment #1 (employees table),"CONCAT() function, CONCAT_WS() for NULL-safe concatenation, string concatenation with separator, NULL handling in concatenation","8 criteria, 100 pts",75 pts,"SQL script (name formatting), formatted names screenshot, documentation (100 words)",Employee Chain: #1→#4→#10→#21→#24→#51→#111
33,🆕 NEW,CRM Company Name Standardization,"CRM database has inconsistent company names: ""ACME CORP"", ""Acme Corp"", ""acme corp"", ""ACME corp"". Data quality issue preventing proper matching. Standardize all to Title Case using INITCAP/PROPER. UPDATE all records.",None - create companies table with intentionally messy data,"UPPER(), LOWER(), INITCAP (PostgreSQL/Oracle) or PROPER (MySQL), case conversion, UPDATE with string functions","9 criteria, 100 pts",75 pts,"SQL script (before/after queries, UPDATE statement), standardization screenshots, documentation (150 words)",STANDALONE - Case conversion and data cleanup
34,🆕 NEW,CSV Import Cleanup - Whitespace Removal,"CSV import added leading/trailing spaces to all text fields. ""  John  Smith  "" instead of ""John Smith"". Preventing exact matches. Clean all name and address fields using TRIM functions. UPDATE all affected records.",None - create table with intentional leading/trailing spaces,"TRIM(), LTRIM(), RTRIM(), removing whitespace, UPDATE for cleanup, REPLACE() for internal multiple spaces","10 criteria, 100 pts",75 pts,"SQL script (dirty data demo, TRIM examples, UPDATE cleanup), before/after screenshots, documentation (150 words)",STANDALONE - Data cleaning techniques
35,🔗 CONTINUES,RetailMart Product Code Rebranding,"Company rebranding: all Electronics SKUs starting with ""ELE-"" must change to ""ELEC-"" (adding C). Thousands of products affected. Use REPLACE() function in UPDATE to change all SKUs in one statement. Verify before/after counts.",Assignment #2 (products table with SKUs),"REPLACE() function, pattern replacement in strings, UPDATE with REPLACE, mass updates, verification queries","9 criteria, 100 pts",75 pts,"SQL script (UPDATE with REPLACE, before/after verification), rebranded SKUs screenshot, documentation (100 words)",Product Chain: #2→#6→#9→#14→#25→#114
36,🆕 NEW,Phone Number Validation,"Contact database has phone numbers in various formats: ""1234567890"", ""(123) 456-7890"", ""123-456-7890"", ""12345"" (invalid). Data quality report needs to identify invalid phone numbers (not exactly 10 digits). Use LENGTH/LEN.",None - create contacts table with varied phone formats,"LENGTH() or LEN(), string length validation, WHERE with length conditions, data quality queries, REGEXP for advanced validation","8 criteria, 100 pts",75 pts,"SQL script (table with varied formats, length validation queries), invalid phones report screenshot, documentation (100 words)",STANDALONE - Length validation technique
37,🔗 CONTINUES,E-Shop Customer Reactivation - Days Since Last Order,Customer retention team identifies at-risk customers: those with >90 days since last order. Calculate days between each customer's most recent order and today. Filter to customers >90 days for reactivation campaign.,Assignment #3 (customers and orders tables),"DATEDIFF() or equivalent, date arithmetic, CURRENT_DATE or NOW(), calculating time intervals, MAX() to find last order","9 criteria, 100 pts",75 pts,"SQL script (days calculation, >90 day filter), at-risk customers screenshot, documentation (150 words)",Order Chain: #3→#5→#11→#22→#23→#112→#113→#119
38,🔗 CONTINUES,GlobalTech Custom Date Formatting,"HR reports printing hire dates need ""Mon DD, YYYY"" format (e.g., ""Jan 15, 2024"") instead of ""2024-01-15"". Format using DATE_FORMAT (MySQL), TO_CHAR (PostgreSQL), or FORMAT (SQL Server) for custom display.",Assignment #1 (employees with hire_date),"DATE_FORMAT (MySQL), TO_CHAR (PostgreSQL), FORMAT (SQL Server), custom date formatting, format string specifications","8 criteria, 100 pts",75 pts,"SQL script (date formatting), formatted dates screenshot, documentation (100 words on DBMS differences)",Employee Chain: #1→#4→#10→#21→#24→#51→#111
39,🔗 CONTINUES,E-Shop Seasonal Analysis,"Marketing planning staffing and promotions. Need to know: (1) Which quarter has most orders (Q1/Q2/Q3/Q4), (2) Which day of week has most orders (Mon-Sun). Extract quarter and weekday from order_date.",Assignment #3 (orders table with dates),"EXTRACT(QUARTER FROM date), EXTRACT(DOW FROM date) or WEEKDAY(), DAYOFWEEK(), date part extraction, grouping by date parts","10 criteria, 100 pts",75 pts,"SQL script (quarter and weekday extraction, grouping), seasonal breakdown screenshot, documentation (150 words)",Order Chain: #3→#5→#11→#22→#23→#112→#113→#119
