#,Type,Scenario Name,Problem Summary,Prerequisites,Tool Features,Success Criteria,Min Pass,Deliverables,Chain/Category
40,🆕 NEW,Invoice Due Date Calculation,"Accounts Receivable sending payment reminders. Invoices due 30 days after invoice_date. Calculate due_date automatically: invoice_date + 30 days. Use INTERVAL, DATE_ADD, or DATEADD depending on DBMS.",None - create invoices table,"Date arithmetic, INTERVAL '30 days' (PostgreSQL), DATE_ADD (MySQL), DATEADD (SQL Server), adding days/months to dates","9 criteria, 100 pts",75 pts,"SQL script (table creation, due date calculation), calculated due dates screenshot, documentation (150 words)",STANDALONE - Date arithmetic techniques
41,🔗 CONTINUES,GlobalTech Hire New Employee,"HR hiring new Software Engineer starting Monday. Insert complete employee record with all required fields: name, email, department, job title, salary, hire date. Let AUTO_INCREMENT generate employee_id automatically.",Assignment #1 (employees table),"INSERT INTO with VALUES, single-row insertion, AUTO_INCREMENT behavior, NOT NULL constraint validation, SELECT to verify","7 criteria, 100 pts",75 pts,"SQL script (INSERT statement, verification SELECT), new employee screenshot, documentation (100 words)",Employee Chain: #1→#4→#10→#21→#24→#51→#111
42,🔗 CONTINUES,E-Shop Archive Old Orders,Database growing too large (performance issues). Archive all orders from before 2020 into archive_orders table for compliance retention but remove from active orders table. Use INSERT INTO...SELECT for bulk copy.,Assignment #3 (orders table with old data),"INSERT INTO...SELECT, bulk copying data between tables, CREATE TABLE LIKE for structure, date-based filtering, archiving strategy","10 criteria, 100 pts",80 pts,"SQL script (archive table creation, INSERT...SELECT, optional DELETE from original), count verification screenshot, documentation (150 words)",Order Chain: #3→#5→#11→#22→#23→#112→#113→#119
43,🔗 CONTINUES,RetailMart Electronics Price Increase,Inflation adjustment approved by CFO: increase all Electronics category prices by 10%. Other categories remain unchanged. Use UPDATE with WHERE category='Electronics' and arithmetic SET price = price * 1.1.,Assignment #2 (products table),"UPDATE statement, SET with arithmetic (multiplication), WHERE for selective updates, verification before/after, percentage increases","9 criteria, 100 pts",75 pts,"SQL script (before SELECT, UPDATE, after SELECT), price change screenshots, documentation (100 words)",Product Chain: #2→#6→#9→#14→#25→#114
44,🔗 CONTINUES,RetailMart Inventory Reduction from Sales,"When orders placed, stock_quantity must decrease. Update products.stock_quantity by subtracting quantities from order_items. Use UPDATE with JOIN to decrement inventory based on sales. Complex multi-table UPDATE.",Assignment #2 (products) + Assignment #3 (order_items),"UPDATE with JOIN, updating from multiple tables, SET with subquery or JOIN, complex UPDATE syntax (varies by DBMS), inventory management","11 criteria, 100 pts",80 pts,"SQL script (UPDATE JOIN), inventory before/after screenshots, documentation (200 words on DBMS UPDATE JOIN syntax)",Product Chain: #2→#6→#9→#14→#25→#114
45,🔗 CONTINUES,E-Shop Remove QA Test Data,"QA testing created test customer accounts (customer_id 9001-9020) with test orders. Production launch tomorrow - must delete ALL test data. DELETE test customers' orders first (due to FK), then customers. Handle CASCADE.","Assignment #3 (customers, orders, order_items with test data)","DELETE with WHERE, IN with subquery or value list, CASCADE deletion, safe deletion verification, transaction recommended","9 criteria, 100 pts",75 pts,"SQL script (DELETE statements, verification), deletion confirmation screenshots, documentation (150 words on DELETE CASCADE)",Order Chain: #3→#5→#11→#22→#23→#112→#113→#119
46,🆕 NEW,Soft Delete Pattern for Audit Trail,Legal department requires maintaining audit trail of all records - cannot permanently DELETE. Implement soft delete: add deleted_at TIMESTAMP column (nullable). Set to NOW() instead of DELETE. Queries exclude WHERE deleted_at IS NULL.,"None - create sample table (e.g., documents)","Soft delete pattern, UPDATE vs DELETE, deleted_at timestamp column, excluding deleted records in queries, audit trail maintenance","11 criteria, 100 pts",80 pts,"SQL script (table with deleted_at, soft delete demos, query exclusion), screenshots showing soft-deleted records, documentation (200 words)",STANDALONE - Audit trail pattern
47,🔗 CONTINUES,RetailMart Product Catalog Upsert,"Supplier sends daily product updates CSV. If SKU exists, UPDATE price and stock. If new SKU, INSERT new product. Handle both in single statement: INSERT...ON DUPLICATE KEY UPDATE (MySQL) or ON CONFLICT (PostgreSQL).",Assignment #2 (products table),"UPSERT operations, INSERT ON DUPLICATE KEY UPDATE (MySQL), ON CONFLICT DO UPDATE (PostgreSQL), MERGE (SQL Server), handling insert/update in one statement","12 criteria, 100 pts",80 pts,"SQL script (UPSERT examples for new/existing records), upsert results screenshots, documentation (200 words on DBMS UPSERT syntax)",Product Chain: #2→#6→#9→#14→#25→#114
48,🆕 NEW,Bank Transfer Transaction Safety,"Process money transfer between accounts: deduct $500 from Account A, add $500 to Account B. BOTH must succeed together or BOTH fail (atomicity). Wrap in transaction with BEGIN/COMMIT. Test ROLLBACK on error.",None - create accounts table with balances,"BEGIN/START TRANSACTION, COMMIT, ROLLBACK, transaction basics, ACID properties (atomicity focus), error handling","10 criteria, 100 pts",80 pts,"SQL script (successful transaction, failed transaction with ROLLBACK), transaction demos screenshots, documentation (200 words on transactions)",STANDALONE - Transaction fundamentals
49,🔗 CONTINUES,E-Shop Customer Account Deletion,Customer requests account deletion (GDPR right to be forgotten). Delete customer record - orders and order_items must CASCADE delete automatically. Verify ON DELETE CASCADE works (from Assignment #3 setup).,"Assignment #3 (customers, orders, order_items with CASCADE)","ON DELETE CASCADE verification, parent-child deletion, referential integrity in action, counting records before/after","9 criteria, 100 pts",75 pts,"SQL script (count queries, DELETE customer, verify cascade), before/after counts for all 3 tables screenshot, documentation (150 words)",Order Chain: #3→#5→#11→#22→#23→#112→#113→#119
50,🆕 NEW,Bulk Product Import Performance,"Loading 100,000 new products from CSV. Compare performance: (1) Individual INSERTs in loop (slow), (2) Multi-row INSERT VALUES (...),(...),(...), (3) LOAD DATA INFILE (MySQL) or COPY (PostgreSQL). Measure time for each.",None - generate or obtain 100k row CSV,"LOAD DATA INFILE (MySQL), \copy or COPY (PostgreSQL), BULK INSERT (SQL Server), bulk operations, performance comparison, INSERT optimization","11 criteria, 100 pts",80 pts,"SQL scripts (all 3 methods), performance comparison table (time in seconds), documentation (250 words on bulk loading best practices)",STANDALONE - Bulk loading techniques
